<!ELEMENT osoby (osoba+)>
<!ELEMENT osoba (imie, nazwisko)>
<!ELEMENT imie (#PCDATA)>
<!ELEMENT nazwisko (#PCDATA)>
<!ATTLIST osoba plec (kobieta|mezczyzna|pokemon) #REQUIRED>
<!ATTLIST osoba plec (kobieta|mezczyzna) #REQUIRED>